Text,Text-MM,Sentiment,Timestamp,User,Platform,Hashtags,Retweets,Likes,Country,Year,Month,Day,Hour
Hosting a sleepover with friends this weekend. Preparing for a night of laughter and memories! ,ဒီစနေ၊ တနင်္ဂနွေ သူငယ်ချင်းတွေနဲ့အတူ အိပ်ယာဝင်ပွဲ ကျင်းပနေပါတယ်။ ရယ်မောခြင်းနဲ့ အမှတ်တရတွေရဲ့ ညတစ်ညအတွက် ပြင်ဆင်နေခြင်း!,Positive,2023-08-17 22:15:00, SleepoverHostHighSchool , Twitter , #SleepoverFun #HighSchoolMemories ,18.0,35.0, UK,2023,8,17,22
"Spent hours on a TikTok dance, only to realize I have two left feet. Dance fail: Unleashed! ",TikTok အကတစ်ခုအတွက် နာရီပေါင်းများစွာ အချိန်ကုန်ခဲ့တယ်၊ ကိုယ့်မှာ ဘယ်ခြေနှစ်ချောင်းရှိတယ်ဆိုတာ သိလိုက်ရမှပဲ။ အက ကျရှုံးမှု - ထုတ်လွှတ်လိုက်ပြီ!,Negative,2023-08-18 16:30:00, TikTokFailHighSchool , Facebook , #DanceFail #HighSchoolTikTok ,25.0,50.0, USA,2023,8,18,16
Accidentally liked my crush's old photo while stalking their profile. Awkward level: Maximum! ,ကိုယ့် crush ရဲ့ profile ကို stalk လုပ်နေတုန်း သူတို့ရဲ့ ဓာတ်ပုံဟောင်းတစ်ခုကို မတော်တဆ like လုပ်မိသွားတယ်။ အဆင်မပြေမှုအဆင့် - အမြင့်ဆုံး!,Negative,2023-08-19 19:45:00, SocialMediaBlunderHighSchool , Instagram , #SocialMediaBlunder #HighSchoolAwkward ,22.0,45.0, UK,2023,8,19,19
Tried to impress my crush with a smooth conversation. Ended up spilling my drink. Smooth level: Nonexistent! ,ချောမွေ့တဲ့ စကားပြောဆိုမှုနဲ့ ကိုယ့် crush ကို စွဲဆောင်ဖို့ ကြိုးစားခဲ့တယ်။ ကိုယ့်သောက်စရာ ဖိတ်ကျသွားတာနဲ့ အဆုံးသတ်ခဲ့တယ်။ ချောမွေ့မှုအဆင့် - မရှိ။,Negative,2023-08-20 17:00:00, CrushFailHighSchool , Twitter , #CrushFail #HighSchoolEmbarrassment ,30.0,60.0, Canada,2023,8,20,17
Mastered the art of creating paper airplanes during lecture. Paper planes: Soaring to new heights! ,ဟောပြောပွဲအတွင်း စက္ကူလေယာဉ်ပျံ ဖန်တီးခြင်း အနုပညာကို ကျွမ်းကျင်ခဲ့တယ်။ စက္ကူလေယာဉ်ပျံများ - အမြင့်အသစ်များဆီသို့ ပျံဝဲနေခြင်း!,Positive,2023-08-21 15:45:00, PaperPlaneExpertHighSchool , Instagram , #PaperPlaneExpert #HighSchoolArt ,15.0,30.0, USA,2023,8,21,15
Trying to set a new trend by juggling textbooks between classes. Academic juggling: A unique skill! ,အတန်းတွေကြားမှာ ကျောင်းစာအုပ်တွေကို juggle လုပ်ခြင်းဖြင့် ခေတ်ရေစီးကြောင်းအသစ်တစ်ခု ဖန်တီးဖို့ ကြိုးစားနေပါတယ်။ ပညာရေးဆိုင်ရာ juggle လုပ်ခြင်း - ထူးခြားတဲ့ ကျွမ်းကျင်မှုတစ်ခု!,Positive,2023-08-22 12:30:00, JugglingProHighSchool , Facebook , #TextbookJuggling #HighSchoolSkills ,22.0,40.0, Canada,2023,8,22,12
Hiding a snack stash in my backpack for emergency cravings. Snack ninja mode: Activated! ,အရေးပေါ် စားချင်စိတ်များအတွက် ကျောပိုးအိတ်ထဲမှာ သရေစာ သိုလှောင်ရုံတစ်ခု ဖွက်ထားခြင်း။ သရေစာ နင်ဂျာမုဒ် - အသက်ဝင်ပြီ!,Positive,2023-08-23 16:45:00, SnackNinjaHighSchool , Twitter , #SnackNinja #HighSchoolSnacks ,28.0,55.0, USA,2023,8,23,16
Planning a surprise scavenger hunt for friends. Anticipating the thrill and excitement! ,သူငယ်ချင်းတွေအတွက် အံ့အားသင့်ဖွယ် ရတနာရှာဖွေပွဲတစ်ခု စီစဉ်နေပါတယ်။ သည်းထိတ်ရင်ဖိုမှုနဲ့ စိတ်လှုပ်ရှားမှုကို မျှော်လင့်နေခြင်း!,Positive,2023-08-24 18:20:00, ScavengerHuntMasterHighSchool , Instagram , #SurpriseAdventure #HighSchoolFun ,20.0,38.0, UK,2023,8,24,18
Danced in the rain to celebrate the end of exams. Rain dance: Unexpectedly refreshing! ,စာမေးပွဲတွေ ပြီးဆုံးတာကို ဂုဏ်ပြုဖို့ မိုးရေထဲမှာ ကခုန်ခဲ့တယ်။ မိုးရေထဲက အက - မမျှော်လင့်ဘဲ လန်းဆန်းစေတယ်။,Positive,2023-08-25 14:15:00, RainDanceCelebrationHighSchool , Facebook , #RainDance #HighSchoolJoy ,25.0,50.0, Canada,2023,8,25,14
Accidentally sent a text meant for a friend to the class group chat. Texting fail: Oops moment! ,သူငယ်ချင်းတစ်ယောက်အတွက် ရည်ရွယ်တဲ့ text တစ်ခုကို အတန်း group chat ထဲသို့ မတော်တဆ ပို့မိသွားတယ်။ Texting ကျရှုံးမှု - အိုးпс အခိုက်အတန့်!,Negative,2023-08-26 17:30:00, GroupChatBlunderHighSchool , Twitter , #TextingFail #HighSchoolAwkward ,18.0,35.0, USA,2023,8,26,17
Tried a magic trick to impress classmates. Magic fail: Where did that rabbit go? ,အတန်းဖော်တွေကို စွဲဆောင်ဖို့ မှော်ပညာတစ်ခု စမ်းသပ်ခဲ့တယ်။ မှော်ပညာ ကျရှုံးမှု - အဲ့ဒီ ယုန် ဘယ်ရောက်သွားလဲ။,Negative,2023-08-27 20:45:00, MagicFailHighSchool , Instagram , #MagicFail #HighSchoolMagic ,22.0,45.0, UK,2023,8,27,20
Perfecting the art of creating origami during a dull lecture. Origami mastery: A+! ,ပျင်းစရာကောင်းတဲ့ ဟောပြောပွဲတစ်ခုအတွင်း origami ဖန်တီးခြင်း အနုပညာကို ပြီးပြည့်စုံအောင် လုပ်ဆောင်နေခြင်း။ Origami ကျွမ်းကျင်မှု - A+!,Positive,2023-08-28 16:00:00, OrigamiProHighSchool , Twitter , #OrigamiMaster #HighSchoolArt ,18.0,36.0, USA,2023,8,28,16
Attempting to set a new record for the most consecutive hacky sack kicks. Hacky sack skills: Unleashed! ,ဆက်တိုက် hacky sack ကန်ချက် အများဆုံးအတွက် စံချိန်သစ်တင်ဖို့ ကြိုးစားနေပါတယ်။ Hacky sack ကျွမ်းကျင်မှုများ - ထုတ်လွှတ်လိုက်ပြီ!,Positive,2023-08-29 13:45:00, HackySackChampionHighSchool , Instagram , #HackySackChallenge #HighSchoolAthlete ,26.0,48.0, Canada,2023,8,29,13
Creating a secret handshake with friends. Friendship level: Expert! ,သူငယ်ချင်းတွေနဲ့ လျှို့ဝှက် လက်ဆွဲနှုတ်ဆက်ခြင်းတစ်ခု ဖန်တီးနေပါတယ်။ သူငယ်ချင်းဆက်ဆံရေးအဆင့် - ကျွမ်းကျင်သူ!,Positive,2023-08-30 17:30:00, SecretHandshakeHighSchool , Facebook , #FriendshipGoals #HighSchoolMemories ,20.0,40.0, USA,2023,8,30,17
Embarking on a mission to find the best burger joint in town. Burger connoisseur: Reporting for duty! ,မြို့ထဲက အကောင်းဆုံး ဘာဂါဆိုင်ကို ရှာဖွေဖို့ မစ်ရှင်တစ်ခု စတင်နေပါတယ်။ ဘာဂါ ကျွမ်းကျင်သူ - တာဝန်အတွက် သတင်းပို့နေခြင်း!,Positive,2023-08-31 20:15:00, BurgerQuestHighSchool , Twitter , #BurgerQuest #HighSchoolFoodie ,24.0,42.0, UK,2023,8,31,20
Practicing a stand-up comedy routine for the upcoming talent show. Comedy gig: In the making! ,လာမယ့် အရည်အချင်းပြပွဲအတွက် stand-up comedy routine တစ်ခု လေ့ကျင့်နေပါတယ်။ ဟာသ ဖျော်ဖြေမှု - ပြုလုပ်နေဆဲ!,Positive,2023-09-01 14:45:00, ComedyGeniusHighSchool , Instagram , #StandUpComedy #HighSchoolTalent ,21.0,39.0, Canada,2023,9,1,14
Accidentally sent a love letter to the wrong person. Love note fail: Maximum embarrassment! ,အချစ်စာတစ်စောင်ကို လူမှားဆီသို့ မတော်တဆ ပို့မိသွားတယ်။ အချစ်စာ ကျရှုံးမှု - အမြင့်ဆုံး ရှက်ရွံ့မှု!,Negative,2023-09-02 18:30:00, LoveLetterBlunderHighSchool , Facebook , #LoveLetterFail #HighSchoolAwkward ,17.0,33.0, USA,2023,9,2,18
Attempting to impress the teacher with an elaborate science experiment. Science geek mode: Activated! ,အသေးစိတ်ကျတဲ့ သိပ္ပံစမ်းသပ်ချက်တစ်ခုနဲ့ ဆရာမကို စွဲဆောင်ဖို့ ကြိုးစားနေပါတယ်။ သိပ္ပံ ဝါသနာရှင်မုဒ် - အသက်ဝင်ပြီ!,Positive,2023-09-03 22:00:00, ScienceExperimentProHighSchool , Twitter , #ScienceGeek #HighSchoolExperiments ,23.0,44.0, UK,2023,9,3,22
Crafting intricate friendship bracelets for the whole squad. Friendship level: Expert weaver! ,အဖွဲ့သားအားလုံးအတွက် ရှုပ်ထွေးတဲ့ သူငယ်ချင်း လက်ပတ်တွေ ဖန်တီးနေပါတယ်။ သူငယ်ချင်းဆက်ဆံရေးအဆင့် - ကျွမ်းကျင် ရက်ကန်းသမား!,Positive,2023-09-04 15:15:00, BraceletCraftsmanHighSchool , Instagram , #FriendshipBracelets #HighSchoolCrafts ,19.0,37.0, USA,2023,9,4,15
Attempting to beat the record for the most consecutive cartwheels. Cartwheel challenge: Underway! ,ဆက်တိုက် cartwheel အများဆုံးအတွက် စံချိန်ကို ချိုးဖျက်ဖို့ ကြိုးစားနေပါတယ်။ Cartwheel စိန်ခေါ်မှု - လုပ်ဆောင်နေဆဲ!,Positive,2023-09-05 12:30:00, CartwheelMasterHighSchool , Twitter , #CartwheelChallenge #HighSchoolAthlete ,27.0,52.0, Canada,2023,9,5,12
Organizing a movie marathon with friends. Popcorn and cinematic adventures await! ,သူငယ်ချင်းတွေနဲ့ ရုပ်ရှင်မာရသွန်တစ်ခု စီစဉ်နေပါတယ်။ ပေါက်ပေါက်ဆုပ်နဲ့ ရုပ်ရှင် စွန့်စားခန်းတွေ စောင့်ကြိုနေတယ်!,Positive,2023-09-06 16:45:00, MovieMarathonHostHighSchool , Facebook , #MovieNight #HighSchoolMemories ,22.0,43.0, UK,2023,9,6,16
Experimenting with a new hair color. A bold change for a bold semester! ,ဆံပင်အရောင်အသစ်တစ်ခုနဲ့ စမ်းသပ်နေပါတယ်။ ရဲရင့်တဲ့ semester အတွက် ရဲရင့်တဲ့ ပြောင်းလဲမှုတစ်ခု!,Positive,2023-09-07 18:20:00, HairColorExperimentHighSchool , Instagram , #HairExperiment #HighSchoolStyle ,20.0,39.0, USA,2023,9,7,18
Building a time capsule to capture memories for the future. Time-traveling emotions! ,အနာဂတ်အတွက် အမှတ်တရတွေကို ဖမ်းယူဖို့ အချိန်တောင့်တစ်ခု တည်ဆောက်နေပါတယ်။ အချိန်ခရီးသွား စိတ်ခံစားမှုများ!,Positive,2023-09-08 14:15:00, TimeCapsuleCreatorHighSchool , Facebook , #TimeCapsule #HighSchoolNostalgia ,26.0,48.0, Canada,2023,9,8,14
Accidentally walked into the wrong classroom on the first day. Classroom mix-up: Awkward start! ,ပထမနေ့မှာ စာသင်ခန်းမှားထဲသို့ မတော်တဆ ဝင်သွားမိတယ်။ စာသင်ခန်း ရောထွေးမှု - အဆင်မပြေတဲ့ အစပြုမှု!,Negative,2023-09-09 17:30:00, ClassroomBlunderHighSchool , Twitter , #FirstDayOops #HighSchoolEmbarrassment ,16.0,32.0, USA,2023,9,9,17
Trying out a new smoothie recipe for a healthy start to the week. Smoothie enthusiast: Level up! ,အပတ်စဉ် ကျန်းမာရေးနဲ့ ညီညွတ်တဲ့ အစပြုမှုအတွက် smoothie recipe အသစ်တစ်ခု စမ်းသပ်နေပါတယ်။ Smoothie ဝါသနာရှင် - အဆင့်တက်ပြီ!,Positive,2023-09-10 20:45:00, SmoothieConnoisseurHighSchool , Instagram , #HealthyLiving #HighSchoolWellness ,23.0,42.0, UK,2023,9,10,20
Reflecting on the challenges of the school year. Feeling a bit overwhelmed with assignments. ,ကျောင်းနှစ်ရဲ့ စိန်ခေါ်မှုတွေကို ပြန်လည်သုံးသပ်နေပါတယ်။ တာဝန်တွေနဲ့ နည်းနည်း လွှမ်းမိုးခံစားနေရတယ်။,Negative,2023-09-11 15:45:00, OverwhelmedHighSchoolStudent , Twitter , #SchoolChallenges #HighSchoolStruggles ,15.0,28.0, USA,2023,9,11,15
Encountered some mean-spirited comments online. Dealing with online hate is never easy. ,အွန်လိုင်းမှာ မရည်ရွယ်ဘဲ မကောင်းတဲ့ မှတ်ချက်တချို့ ကြုံတွေ့ခဲ့ရတယ်။ အွန်လိုင်း အမုန်းတရားကို ရင်ဆိုင်ရတာ ဘယ်တော့မှ မလွယ်ဘူး။,Negative,2023-09-12 12:30:00, DealingWithHateHighSchool , Instagram , #OnlineHate #HighSchoolReality ,18.0,36.0, Canada,2023,9,12,12
Had a bad day at school. Everything seems to be going wrong. ,ကျောင်းမှာ နေ့ဆိုးတစ်နေ့ ကြုံခဲ့ရတယ်။ အရာအားလုံး မှားယွင်းနေပုံပဲ။,Negative,2023-09-13 16:45:00, ToughDayHighSchool , Facebook , #BadDay #HighSchoolBlues ,20.0,40.0, UK,2023,9,13,16
Feeling down after not making the sports team. Disappointment lingers. ,အားကစားအသင်းမှာ မပါဝင်ရတဲ့အတွက် စိတ်ဓာတ်ကျနေတယ်။ စိတ်ပျက်မှုက ဆက်ရှိနေတုန်းပဲ။,Negative,2023-09-14 18:20:00, SportsTeamRejectionHighSchool , Twitter , #Disappointment #HighSchoolSports ,17.0,34.0, USA,2023,9,14,18
Witnessed a heated argument in the cafeteria. Unpleasant atmosphere at lunch. ,ကန်တင်းမှာ ပြင်းထန်တဲ့ ငြင်းခုံမှုတစ်ခု တွေ့မြင်ခဲ့ရတယ်။ နေ့လည်စာမှာ မနှစ်မြို့ဖွယ် လေထု။,Negative,2023-09-15 14:15:00, CafeteriaConflictHighSchool , Instagram , #CafeteriaDrama #HighSchoolTension ,21.0,41.0, Canada,2023,9,15,14
Received a not-so-great grade on a major project. Academic frustration setting in. ,အဓိက ပရောဂျက်တစ်ခုမှာ သိပ်မကောင်းတဲ့ အဆင့် ရရှိခဲ့တယ်။ ပညာရေးဆိုင်ရာ စိတ်ပျက်မှု ဝင်လာနေပြီ။,Negative,2023-09-16 17:30:00, ProjectGradeDisappointmentHighSchool , Facebook , #AcademicFrustration #HighSchoolStress ,19.0,38.0, UK,2023,9,16,17
Dealing with a personal setback. Sometimes life throws unexpected challenges. ,ကိုယ်ပိုင် အဆင်မပြေမှုတစ်ခုကို ရင်ဆိုင်နေရတယ်။ တစ်ခါတလေ ဘဝက မမျှော်လင့်ထားတဲ့ စိန်ခေါ်မှုတွေ ပစ်ပေါက်တတ်တယ်။,Negative,2023-09-17 20:45:00, PersonalSetbackHighSchool , Twitter , #LifeChallenges #HighSchoolStruggles ,22.0,44.0, USA,2023,9,17,20
Feeling lonely on a Saturday night. Sometimes solitude hits harder than expected. ,စနေနေ့ညမှာ အထီးကျန်မှု ခံစားနေရတယ်။ တစ်ခါတလေ အထီးကျန်မှုက မျှော်လင့်ထားတာထက် ပိုပြင်းထန်စွာ ထိခိုက်တတ်တယ်။,Negative,2023-09-18 22:00:00, LonelySaturdayHighSchool , Instagram , #LonelyNights #HighSchoolEmotions ,16.0,31.0, Canada,2023,9,18,22
Experiencing cyberbullying. Hateful messages online are disheartening. ,Cyberbullying ကြုံတွေ့နေရတယ်။ အွန်လိုင်းက အမုန်းတရား မက်ဆေ့ချ်တွေက စိတ်ပျက်စရာကောင်းတယ်။,Negative,2023-09-19 15:15:00, CyberbullyingVictimHighSchool , Facebook , #StopCyberbullying #HighSchoolReality ,14.0,27.0, UK,2023,9,19,15
Caught in a torrential rainstorm without an umbrella. Today's weather is just bad luck. ,ထီးမပါဘဲ သည်းထန်တဲ့ မိုးသက်မုန်တိုင်းထဲမှာ မိနေတယ်။ ဒီနေ့ ရာသီဥတုက ကံဆိုးတာပဲ။,Negative,2023-09-20 12:30:00, RainyDayBluesHighSchool , Twitter , #BadLuck #HighSchoolWeather ,18.0,35.0, USA,2023,9,20,12
Missing an important event due to unforeseen circumstances. A day filled with sadness. ,မမျှော်လင့်ထားတဲ့ အခြေအနေတွေကြောင့် အရေးကြီးတဲ့ ပွဲတစ်ခု လွဲချော်သွားတယ်။ ဝမ်းနည်းမှုတွေနဲ့ ပြည့်နေတဲ့ နေ့တစ်နေ့။,Negative,2023-09-21 16:45:00, MissedOpportunityHighSchool , Instagram , #MissedChances #HighSchoolRegret ,20.0,39.0, Canada,2023,9,21,16
Dealing with unfounded rumors circulating about personal life. Rumors can be hurtful. ,ကိုယ်ပိုင်ဘဝအကြောင်း ပျံ့နှံ့နေတဲ့ အခြေအမြစ်မရှိတဲ့ ကောလာဟလတွေကို ရင်ဆိုင်နေရတယ်။ ကောလာဟလတွေက နာကျင်စေနိုင်တယ်။,Negative,2023-09-22 18:20:00, RumorVictimHighSchool , Facebook , #RumorMills #HighSchoolDrama ,23.0,46.0, UK,2023,9,22,18
Got a flat tire on the way to an important meeting. Talk about a series of bad events! ,အရေးကြီးတဲ့ အစည်းအဝေးတစ်ခု သွားရာလမ်းမှာ တာယာပြားသွားတယ်။ ဆိုးရွားတဲ့ အဖြစ်အပျက်တွေ ဆက်တိုက်ဖြစ်တာ ပြောစမ်းပါ။,Negative,2023-09-23 14:15:00, FlatTireWoesHighSchool , Twitter , #BadLuckDay #HighSchoolStruggles ,25.0,50.0, USA,2023,9,23,14
Feeling a sense of emptiness after a close friend moves away. Farewells are always sad. ,ရင်းနှီးတဲ့ သူငယ်ချင်းတစ်ယောက် ပြောင်းရွှေ့သွားပြီးနောက် လစ်ဟာမှု ခံစားချက်။ နှုတ်ဆက်ပွဲတွေက အမြဲတမ်း ဝမ်းနည်းစရာကောင်းတယ်။,Negative,2023-09-24 17:30:00, FriendMovingAwayHighSchool , Instagram , #SayingGoodbye #HighSchoolEmotions ,21.0,42.0, Canada,2023,9,24,17
Facing rejection from a dream college. Disheartened but determined to explore other paths. ,အိပ်မက် ကောလိပ်တစ်ခုကနေ ငြင်းပယ်ခံရခြင်း။ စိတ်ပျက်မိပေမယ့် အခြားလမ်းကြောင်းတွေကို စူးစမ်းရှာဖွေဖို့ စိတ်ပိုင်းဖြတ်ထားတယ်။,Negative,2023-09-25 20:45:00, CollegeRejectionHighSchool , Facebook , #CollegeDreams #HighSchoolJourney ,19.0,37.0, UK,2023,9,25,20
Encountering online toxicity during a gaming session. Hateful comments can ruin the fun. ,ဂိမ်းကစားချိန်အတွင်း အွန်လိုင်း အဆိပ်အတောက် ကြုံတွေ့ရခြင်း။ အမုန်းတရား မှတ်ချက်တွေက ပျော်ရွှင်မှုကို ဖျက်ဆီးနိုင်တယ်။,Negative,2023-09-26 14:15:00, GamingToxicityHighSchool , Twitter , #OnlineGaming #HighSchoolGamer ,16.0,32.0, USA,2023,9,26,14
Having a bad hair day and feeling self-conscious. Bad hair days can affect confidence. ,ဆံပင်ပုံစံဆိုးတဲ့နေ့ ကြုံပြီး ကိုယ့်ကိုယ်ကို သတိထားမိနေခြင်း။ ဆံပင်ပုံစံဆိုးတဲ့နေ့တွေက ယုံကြည်မှုကို ထိခိုက်စေနိုင်တယ်။,Negative,2023-09-27 17:30:00, BadHairDayBluesHighSchool , Instagram , #BadHairDay #HighSchoolConfidence ,18.0,36.0, Canada,2023,9,27,17
Feeling a sense of despair after a major project failure. Hard work didn't pay off this time. ,အဓိက ပရောဂျက်တစ်ခု ကျရှုံးပြီးနောက် စိတ်ပျက်အားငယ်မှု ခံစားချက်။ ကြိုးစားအားထုတ်မှုက ဒီတစ်ခါ အရာမထင်ခဲ့ဘူး။,Negative,2023-09-28 22:00:00, ProjectFailureDespairHighSchool , Facebook , #ProjectStruggles #HighSchoolHardships ,21.0,41.0, UK,2023,9,28,22
Experiencing hate comments for expressing personal opinions. Online negativity prevails. ,ကိုယ်ပိုင် ထင်မြင်ချက်တွေ ဖော်ပြတဲ့အတွက် အမုန်းတရား မှတ်ချက်တွေ ကြုံတွေ့ရခြင်း။ အွန်လိုင်း အပျက်သဘောဆောင်မှုက လွှမ်းမိုးနေတယ်။,Negative,2023-09-29 15:45:00, OpinionsHateHighSchool , Twitter , #OnlineOpinions #HighSchoolCriticism ,24.0,48.0, USA,2023,9,29,15
Having a string of bad luck with constant technology malfunctions. Tech troubles galore! ,စဉ်ဆက်မပြတ် နည်းပညာ ချို့ယွင်းမှုတွေနဲ့ ကံဆိုးမှု ဆက်တိုက်ကြုံတွေ့နေရခြင်း။ နည်းပညာ ပြဿနာတွေ အများကြီး!,Negative,2023-09-30 18:20:00, TechMalfunctionWoesHighSchool , Instagram , #TechIssues #HighSchoolTech ,22.0,43.0, Canada,2023,9,30,18
Missing out on a long-anticipated event due to unexpected circumstances. A day filled with sadness. ,မမျှော်လင့်ထားတဲ့ အခြေအနေတွေကြောင့် ကြာရှည်စွာ စောင့်မျှော်နေတဲ့ ပွဲတစ်ခု လွဲချော်သွားခြင်း။ ဝမ်းနည်းမှုတွေနဲ့ ပြည့်နေတဲ့ နေ့တစ်နေ့။,Negative,2023-10-01 14:15:00, MissedEventBluesHighSchool , Facebook , #MissedMoments #HighSchoolRegret ,20.0,39.0, UK,2023,10,1,14
Trying out a new study technique for upcoming exams. Exploring different learning strategies. ,လာမယ့် စာမေးပွဲတွေအတွက် စာကျက်နည်းစနစ်အသစ်တစ်ခု စမ်းသပ်နေပါတယ်။ ကွဲပြားတဲ့ သင်ယူမှု နည်းဗျူဟာတွေကို စူးစမ်းရှာဖွေနေခြင်း။,Neutral,2023-10-02 16:45:00, StudyTechniqueExperimentHighSchool , Instagram , #StudyStrategies #HighSchoolExams ,23.0,42.0, USA,2023,10,2,16
