Text,Text-MM,Sentiment,Timestamp,User,Platform,Hashtags,Retweets,Likes,Country,Year,Month,Day,Hour
Appreciation for the vibrant culture experienced during travel.   ,ခရီးသွားစဉ်အတွင်း ကြုံတွေ့ခဲ့ရတဲ့ တက်ကြွတဲ့ ယဉ်ကျေးမှုအတွက် တန်ဖိုးထားလေးစားမှု။,Positive,2016-11-14 13:45:00, CultureExplorer , Twitter  , #Appreciation #CulturalExperience        ,28.0,55.0, UK                ,2016,11,14,13
Confidence soars after overcoming public speaking anxiety.       ,လူရှေ့စကားပြော ကြောက်ရွံ့မှုကို ကျော်လွှားပြီးနောက် ယုံကြည်မှု မြင့်တက်လာပါတယ်။,Positive,2020-04-02 17:30:00, PublicSpeaker   , Instagram , #Confidence #OvercomingAnxiety          ,15.0,30.0, USA               ,2020,4,2,17
Contentment in the midst of a family gathering filled with laughter. ,ရယ်မောသံတွေနဲ့ ပြည့်နေတဲ့ မိသားစုစုဝေးပွဲတစ်ခုရဲ့ အလယ်မှာ ကျေနပ်မှု။,Positive,2023-01-15 19:00:00, FamilyCelebration , Facebook , #Contentment #FamilyLaughter             ,25.0,50.0, Canada            ,2023,1,15,19
Enthusiasm for learning new skills and expanding knowledge.      ,ကျွမ်းကျင်မှုအသစ်တွေ သင်ယူပြီး ဗဟုသုတ တိုးပွားဖို့ စိတ်အားထက်သန်မှု။,Positive,2018-08-07 12:15:00, LifelongLearner , Twitter  , #Enthusiasm #SkillBuilding               ,30.0,60.0, India             ,2018,8,7,12
Surprise and delight at discovering a hidden gem in the city.    ,မြို့ထဲက လျှို့ဝှက်နေရာလေးတစ်ခုကို ရှာဖွေတွေ့ရှိရလို့ အံ့သြဝမ်းသာမှု။,Positive,2019-10-18 16:45:00, CityExplorer    , Instagram , #Surprise #HiddenGem                      ,18.0,35.0, UK                ,2019,10,18,16
A sense of accomplishment after completing a challenging workout.,စိန်ခေါ်မှုရှိတဲ့ လေ့ကျင့်ခန်းတစ်ခု ပြီးမြောက်ပြီးနောက် အောင်မြင်မှု ခံစားချက်။,Positive,2022-06-30 07:00:00, FitnessAchiever , Facebook , #Accomplishment #FitnessSuccess         ,22.0,45.0, Australia          ,2022,6,30,7
Wonderment at the beauty of a double rainbow after the rain.     ,မိုးရွာပြီးနောက် သက်တံနှစ်ထပ်ရဲ့ အလှတရားကို အံ့သြတကြီး ငေးမောခြင်း။,Positive,2017-06-12 18:20:00, RainbowChaser   , Twitter  , #Wonderment #DoubleRainbow               ,35.0,70.0, USA               ,2017,6,12,18
Optimism for a bright future amidst challenging times.           ,စိန်ခေါ်မှုတွေကြားထဲက တောက်ပတဲ့ အနာဂတ်အတွက် အကောင်းမြင်စိတ်။,Positive,2021-07-05 09:30:00, FutureOptimist  , Instagram , #Optimism #BrightFuture                  ,20.0,40.0, Canada            ,2021,7,5,9
Pride in achieving a personal milestone in career progression.   ,အသက်မွေးဝမ်းကျောင်း တိုးတက်မှုမှာ ကိုယ်ပိုင်မှတ်တိုင်တစ်ခုကို အောင်မြင်မှုအတွက် ဂုဏ်ယူခြင်း။,Positive,2016-04-15 14:50:00, CareerAchiever  , Facebook , #Pride #CareerMilestone                  ,28.0,55.0, UK                ,2016,4,15,14
Happiness blooms like flowers in a garden on a sunny day.        ,နေသာတဲ့နေ့တစ်နေ့မှာ ဥယျာဉ်ထဲက ပန်းတွေလို ပျော်ရွှင်မှု ပွင့်လန်းလာပါတယ်။,Positive,2020-02-10 11:15:00, SunnyDayEnthusiast , Twitter  , #Happiness #SunnyDay                      ,15.0,30.0, India             ,2020,2,10,11
Elation over discovering a rare book in a quaint bookstore.      ,ချစ်စရာကောင်းတဲ့ စာအုပ်ဆိုင်လေးတစ်ခုမှာ ရှားပါးစာအုပ်တစ်အုပ် ရှာဖွေတွေ့ရှိခြင်းအပေါ် ရွှင်လန်းတက်ကြွမှု။,Positive,2018-09-22 16:30:00, Bookworm        , Instagram , #Elation #RareBookDiscovery              ,40.0,80.0, USA               ,2018,9,22,16
Curiosity piqued by the mysteries of an ancient archaeological site.,ရှေးဟောင်းသုတေသန နေရာတစ်ခုရဲ့ လျှို့ဝှက်ဆန်းကြယ်မှုတွေကြောင့် စူးစမ်းလိုစိတ် ဖြစ်ပေါ်လာပါတယ်။,Positive,2015-11-08 10:00:00, ArchaeologyEnthusiast , Facebook , #Curiosity #AncientMysteries            ,18.0,35.0, Australia          ,2015,11,8,10
Mesmerized by the cosmic dance of fireflies on a moonlit night.    ,လသာညမှာ ပိုးစုန်းကြူးတွေရဲ့ စကြဝဠာအကကြောင့် စွဲလန်းမိပါတယ်။,Positive,2022-08-10 22:00:00, NightSkyObserver , Instagram , #Enchantment #CosmicFireflies             ,25.0,50.0, Brazil           ,2022,8,10,22
Intrigued by the symphony of colors in an abstract art exhibition. ,Abstract အနုပညာပြပွဲတစ်ခုက အရောင်အသွေးတွေရဲ့ သံစုံတီးဝိုင်းကြောင့် စိတ်ဝင်စားမိပါတယ်။,Positive,2019-04-05 17:30:00, ArtConnoisseur  , Twitter  , #Intrigue #AbstractArt                   ,18.0,35.0, France           ,2019,4,5,17
Giggles and joy echo in the air during a children's playdate.      ,ကလေးတွေရဲ့ ကစားပွဲနေ့အတွင်း ရယ်သံလွင်လွင်နဲ့ ပျော်ရွှင်မှုတွေ လေထဲမှာ ပဲ့တင်ထပ်နေပါတယ်။,Positive,2020-12-15 15:45:00, PlayfulParent   , Facebook , #PlayfulJoy #ChildrensPlaydate           ,22.0,45.0, Japan            ,2020,12,15,15
Enveloped in serenity while practicing mindfulness by the lake.    ,ကန်နဘေးမှာ သတိပဋ္ဌာန် ကျင့်ကြံနေချိန်မှာ တည်ငြိမ်အေးချမ်းမှုက လွှမ်းခြုံထားပါတယ်။,Positive,2017-10-20 08:15:00, ZenSeeker       , Instagram , #Mindfulness #LakeTranquility            ,35.0,70.0, Canada           ,2017,10,20,8
Chasing dreams like a kite soaring high in the vast open sky.      ,ကျယ်ပြန့်တဲ့ ကောင်းကင်ယံမှာ မြင့်မားစွာ ပျံဝဲနေတဲ့ စွန်လို အိပ်မက်တွေကို လိုက်ဖမ်းနေပါတယ်။,Positive,2021-02-28 13:00:00, SkyDreamer      , Twitter  , #DreamChaser #SkyHighDreams              ,30.0,60.0, Australia         ,2021,2,28,13
Spellbound by the elegance of a ballroom dance under crystal chandeliers. ,ကြည်လင်တဲ့ မီးဆိုင်းတွေအောက်က ကပွဲခန်းမအကရဲ့ ကျက်သရေရှိမှုကြောင့် စွဲလန်းမိပါတယ်။,Positive,2018-06-12 20:30:00, DanceEnthusiast , Facebook , #Elegance #BallroomDance                ,28.0,55.0, UK               ,2018,6,12,20
Whimsical delight in a world of fairy tales and magical creatures.  ,ဒဏ္ဍာရီပုံပြင်တွေနဲ့ မှော်ဆန်တဲ့ သတ္တဝါတွေရဲ့ လောကထဲက စိတ်ကူးယဉ်ဆန်တဲ့ ပျော်ရွှင်မှု။,Positive,2016-03-08 14:20:00, FairyTaleExplorer , Instagram , #Whimsy #MagicalWorld                    ,20.0,40.0, USA             ,2016,3,8,14
Pensive contemplation amid the ancient ruins of a forgotten civilization. ,မေ့လျော့နေတဲ့ ယဉ်ကျေးမှုတစ်ခုရဲ့ ရှေးဟောင်းအပျက်အစီးတွေကြားထဲက အတွေးနက်နေတဲ့ စဉ်းစားတွေးတောမှု။,Negative,2023-04-18 17:10:00, RuinsExplorer   , Twitter  , #Pensive #AncientCivilization           ,18.0,35.0, Greece           ,2023,4,18,17
Embracing the thrill of speed on a rollercoaster's exhilarating twists. ,ရိုလာကိုစတာရဲ့ စိတ်လှုပ်ရှားဖွယ် လှည့်ကွက်တွေပေါ်က အရှိန်ရဲ့ သည်းထိတ်ရင်ဖိုမှုကို ပွေ့ဖက်ခြင်း။,Positive,2020-07-25 12:45:00, RollercoasterFan , Facebook , #Thrill #RollercoasterAdventure        ,22.0,45.0, Germany         ,2020,7,25,12
Harmony resonates as musicians play a melody of unity and togetherness. ,ဂီတပညာရှင်တွေက စည်းလုံးညီညွတ်မှုနဲ့ အတူတကွရှိမှုရဲ့ သံစဉ်တစ်ခုကို တီးခတ်ချိန်မှာ သဟဇာတဖြစ်မှုက ပဲ့တင်ထပ်နေပါတယ်။,Positive,2019-11-30 19:30:00, MusicHarmonist  , Instagram , #Harmony #MusicalUnity                   ,35.0,70.0, Sweden          ,2019,11,30,19
A burst of creativity in the quiet solitude of an artist's studio.  ,အနုပညာရှင်တစ်ယောက်ရဲ့ တိတ်ဆိတ်ငြိမ်သက်တဲ့ တစ်ကိုယ်တည်းနေရာထဲက ဖန်တီးမှု ပေါက်ကွဲထွက်ခြင်း။,Positive,2015-09-01 16:00:00, StudioArtist    , Twitter  , #Creativity #ArtistsHaven               ,15.0,30.0, Italy           ,2015,9,1,16
Radiant joy akin to blooming flowers on a sun-kissed spring morning. ,နေရောင်ခြည်ထိတွေ့နေတဲ့ နွေဦးရာသီ မနက်ခင်းမှာ ပွင့်လန်းနေတဲ့ ပန်းတွေနဲ့ တူတဲ့ တောက်ပတဲ့ ပျော်ရွှင်မှု။,Positive,2022-05-05 10:15:00, SpringEnthusiast , Facebook , #Radiance #SpringBlooms                 ,25.0,50.0, Netherlands     ,2022,5,5,10
A sense of wonder at the vastness of the cosmos on a stargazing night. ,ကြယ်ကြည့်တဲ့ညတစ်ညမှာ စကြဝဠာရဲ့ ကျယ်ပြန့်မှုကို အံ့သြတကြီး ခံစားရခြင်း။,Positive,2018-07-08 23:00:00, CosmosExplorer  , Instagram , #Wonder #StargazingAdventure            ,40.0,80.0, South Africa    ,2018,7,8,23
Rejuvenated by the salty breeze and the sound of waves at the seaside. ,ပင်လယ်ကမ်းစပ်က ဆားငန်လေနဲ့ လှိုင်းသံတွေကြောင့် လန်းဆန်းတက်ကြွလာခြင်း။,Positive,2021-09-20 14:30:00, SeaBreezeLover , Twitter  , #Rejuvenation #SeasideEscape            ,18.0,35.0, Spain           ,2021,9,20,14
Whispers of inspiration from the rustling leaves in a serene forest. ,တည်ငြိမ်အေးချမ်းတဲ့ တောအုပ်ထဲက တရှဲရှဲမြည်နေတဲ့ သစ်ရွက်တွေဆီက စိတ်ကူးစိတ်သန်း တီးတိုးသံတွေ။,Positive,2016-11-15 11:45:00, ForestDreamer   , Facebook , #Inspiration #ForestWhispers            ,28.0,55.0, Portugal        ,2016,11,15,11
Savoring the warmth of a cup of cocoa on a chilly winter evening.   ,အေးစိမ့်တဲ့ ဆောင်းရာသီ ညနေခင်းမှာ ကိုကိုးပူပူတစ်ခွက်ရဲ့ နွေးထွေးမှုကို အရသာခံနေပါတယ်။,Positive,2020-01-12 18:00:00, WinterWarmth    , Instagram , #Coziness #WarmWinterEvening           ,30.0,60.0, Switzerland     ,2020,1,12,18
Heartfelt gratitude for the laughter shared during a family reunion. ,မိသားစု ပြန်လည်ဆုံစည်းပွဲအတွင်း မျှဝေခံစားခဲ့ရတဲ့ ရယ်မောသံတွေအတွက် ရင်ထဲက ကျေးဇူးတင်ခြင်း။,Positive,2017-12-28 19:15:00, FamilyGatherer , Facebook , #Gratitude #FamilyLaughter              ,22.0,45.0, Austria         ,2017,12,28,19
"Embarking on a culinary adventure, savoring exotic flavors around the world. ",အစားအသောက် စွန့်စားခန်းတစ်ခုကို စတင်ခြင်း၊ ကမ္ဘာတစ်ဝှမ်းက ထူးခြားဆန်းပြားတဲ့ အရသာတွေကို အရသာခံခြင်း။,Positive,2019-03-02 20:20:00, CulinaryExplorer , Twitter  , #Adventure #CulinaryJourney             ,35.0,70.0, Belgium         ,2019,3,2,20
Euphoria floods in as the final puzzle piece clicks into place.       ,နောက်ဆုံး ပဟေဠိအပိုင်းအစ နေရာတကျဖြစ်သွားချိန်မှာ အလွန်အမင်း ပျော်ရွှင်မှုတွေ ပြည့်လျှံလာပါတယ်။,Positive,2022-06-08 15:30:00, PuzzleSolver    , Instagram , #Euphoria #PuzzleCompletion            ,20.0,40.0, Denmark         ,2022,6,8,15
Awe-inspired by the grandeur of an ancient cathedral's intricate architecture. ,ရှေးဟောင်း ဘုရားရှိခိုးကျောင်းကြီးတစ်ခုရဲ့ ရှုပ်ထွေးတဲ့ ဗိသုကာလက်ရာရဲ့ ခမ်းနားထည်ဝါမှုကြောင့် အံ့သြတကြီး ဖြစ်မိပါတယ်။,Positive,2018-08-18 14:45:00, CathedralVisitor , Facebook , #Awe #ArchitecturalGrandeur            ,18.0,35.0, Czech Republic  ,2018,8,18,14
Captivated by the ethereal beauty of a field filled with fireflies. ,ပိုးစုန်းကြူးတွေနဲ့ ပြည့်နေတဲ့ လယ်ကွင်းတစ်ခုရဲ့ အခြားကမ္ဘာဆန်တဲ့ အလှတရားကြောင့် စွဲလန်းမိပါတယ်။,Positive,2022-08-10 22:00:00, NightSkyObserver , Instagram , #Enchantment #FireflyField              ,25.0,50.0, Brazil           ,2022,8,10,22
Immersed in the enchanting melodies of a street musician's violin. ,လမ်းဘေး ဂီတပညာရှင်တစ်ယောက်ရဲ့ တယောရဲ့ စွဲမက်ဖွယ် သံစဉ်တွေထဲမှာ နစ်မြုပ်နေပါတယ်။,Positive,2019-04-05 17:30:00, MusicLover      , Twitter  , #Melodic #StreetMusic                   ,18.0,35.0, France           ,2019,4,5,17
Joyful laughter resonates through a lively summer carnival.         ,တက်ကြွတဲ့ နွေရာသီ ပျော်ပွဲရွှင်ပွဲတစ်ခုတစ်လျှောက် ပျော်ရွှင်ဖွယ် ရယ်မောသံတွေ ပဲ့တင်ထပ်နေပါတယ်။,Positive,2020-12-15 15:45:00, CarnivalGoer    , Facebook , #FestiveJoy #SummerCarnival             ,22.0,45.0, Japan            ,2020,12,15,15
Exploring the universe within during a mindful meditation session. ,သတိပဋ္ဌာန် တရားထိုင်ချိန်အတွင်း အတွင်းစိတ် စကြဝဠာကို စူးစမ်းရှာဖွေနေပါတယ်။,Positive,2017-10-20 08:15:00, MindfulExplorer , Instagram , #InnerJourney #MeditationBliss          ,35.0,70.0, Canada           ,2017,10,20,8
Soaring like a free spirit on the winds of a coastal cliff.        ,ကမ်းရိုးတန်း ချောက်ကမ်းပါးရဲ့ လေပြင်းတွေပေါ်မှာ လွတ်လပ်တဲ့ စိတ်ဓာတ်လို ပျံဝဲနေပါတယ်။,Positive,2021-02-28 13:00:00, CoastalExplorer , Twitter  , #Freedom #CoastalAdventure              ,30.0,60.0, Australia         ,2021,2,28,13
Dazzled by the elegance of a masquerade ball's dazzling costumes. ,မျက်နှာဖုံးစွပ် ကပွဲတစ်ခုရဲ့ တောက်ပတဲ့ ဝတ်စုံတွေရဲ့ ကျက်သရေရှိမှုကြောင့် အံ့သြမှင်သက်မိပါတယ်။,Positive,2018-06-12 20:30:00, MasqueradeAttendee , Facebook , #Dazzle #MasqueradeElegance            ,28.0,55.0, UK               ,2018,6,12,20
Whimsical delight in a world of whimsical fairy tales.             ,စိတ်ကူးယဉ်ဆန်တဲ့ ဒဏ္ဍာရီပုံပြင်တွေရဲ့ လောကထဲက စိတ်ကူးယဉ်ဆန်တဲ့ ပျော်ရွှင်မှု။,Positive,2016-03-08 14:20:00, FairyTaleAdventurer , Instagram , #Whimsy #FairyTaleMagic                 ,20.0,40.0, USA             ,2016,3,8,14
Reflective contemplation amid the ruins of a forgotten era.        ,မေ့လျော့နေတဲ့ ခေတ်တစ်ခုရဲ့ အပျက်အစီးတွေကြားထဲက ပြန်လည်သုံးသပ် စဉ်းစားတွေးတောမှု။,Positive,2023-04-18 17:10:00, RuinsExplorer   , Twitter  , #Reflection #ForgottenEra               ,18.0,35.0, Greece           ,2023,4,18,17
Riding the adrenaline rush on a rollercoaster's wild twists.      ,ရိုလာကိုစတာရဲ့ ရိုင်းစိုင်းတဲ့ လှည့်ကွက်တွေပေါ်က အဒရီနယ်လင်း ထွက်ရှိမှုရဲ့ စိတ်လှုပ်ရှားမှုကို စီးနင်းနေပါတယ်။,Negative,2020-07-25 12:45:00, ThrillSeeker    , Facebook , #Adrenaline #RollercoasterThrills      ,22.0,45.0, Germany         ,2020,7,25,12
Harmony resonates as musicians play a symphony of unity.           ,ဂီတပညာရှင်တွေက စည်းလုံးညီညွတ်မှုရဲ့ သံစုံတီးဝိုင်းတစ်ခုကို တီးခတ်ချိန်မှာ သဟဇာတဖြစ်မှုက ပဲ့တင်ထပ်နေပါတယ်။,Positive,2019-11-30 19:30:00, MusicHarmonist  , Instagram , #Harmony #MusicalUnity                   ,35.0,70.0, Sweden          ,2019,11,30,19
A burst of artistic creativity in the quietude of an artist's studio. ,အနုပညာရှင်တစ်ယောက်ရဲ့ တိတ်ဆိတ်ငြိမ်သက်မှုထဲက အနုပညာ ဖန်တီးမှု ပေါက်ကွဲထွက်ခြင်း။,Positive,2015-09-01 16:00:00, StudioArtist    , Twitter  , #ArtisticBurst #StudioCreativity       ,15.0,30.0, Italy           ,2015,9,1,16
Radiant joy akin to blossoming flowers on a sunlit spring morning. ,နေရောင်ခြည်ထိတွေ့နေတဲ့ နွေဦးရာသီ မနက်ခင်းမှာ ပွင့်လန်းနေတဲ့ ပန်းတွေနဲ့ တူတဲ့ တောက်ပတဲ့ ပျော်ရွှင်မှု။,Positive,2022-05-05 10:15:00, SpringEnthusiast , Facebook , #Radiance #SpringBlooms                 ,25.0,50.0, Netherlands     ,2022,5,5,10
Awe-inspired by the vastness of the cosmos on a stargazing night.   ,ကြယ်ကြည့်တဲ့ညတစ်ညမှာ စကြဝဠာရဲ့ ကျယ်ပြန့်မှုကြောင့် အံ့သြတကြီး ဖြစ်မိပါတယ်။,Positive,2018-07-08 23:00:00, CosmosExplorer  , Instagram , #Wonder #StargazingAdventure            ,40.0,80.0, South Africa    ,2018,7,8,23
Rejuvenated by the salty breeze and the sound of waves at the seaside. ,ပင်လယ်ကမ်းစပ်က ဆားငန်လေနဲ့ လှိုင်းသံတွေကြောင့် လန်းဆန်းတက်ကြွလာခြင်း။,Positive,2021-09-20 14:30:00, SeaBreezeLover , Twitter  , #Rejuvenation #SeasideEscape            ,18.0,35.0, Spain           ,2021,9,20,14
Whispers of inspiration from the rustling leaves in a serene forest. ,တည်ငြိမ်အေးချမ်းတဲ့ တောအုပ်ထဲက တရှဲရှဲမြည်နေတဲ့ သစ်ရွက်တွေဆီက စိတ်ကူးစိတ်သန်း တီးတိုးသံတွေ။,Positive,2016-11-15 11:45:00, ForestDreamer   , Facebook , #Inspiration #ForestWhispers            ,28.0,55.0, Portugal        ,2016,11,15,11
Savoring the warmth of a cup of cocoa on a chilly winter evening.   ,အေးစိမ့်တဲ့ ဆောင်းရာသီ ညနေခင်းမှာ ကိုကိုးပူပူတစ်ခွက်ရဲ့ နွေးထွေးမှုကို အရသာခံနေပါတယ်။,Positive,2020-01-12 18:00:00, WinterWarmth    , Instagram , #Coziness #WarmWinterEvening           ,30.0,60.0, Switzerland     ,2020,1,12,18
Heartfelt gratitude for the laughter shared during a family reunion. ,မိသားစု ပြန်လည်ဆုံစည်းပွဲအတွင်း မျှဝေခံစားခဲ့ရတဲ့ ရယ်မောသံတွေအတွက် ရင်ထဲက ကျေးဇူးတင်ခြင်း။,Positive,2017-12-28 19:15:00, FamilyGatherer , Facebook , #Gratitude #FamilyLaughter              ,22.0,45.0, Austria         ,2017,12,28,19
"Embarking on a culinary odyssey, savoring flavors around the world. ",အစားအသောက် ခရီးရှည်တစ်ခုကို စတင်ခြင်း၊ ကမ္ဘာတစ်ဝှမ်းက အရသာတွေကို အရသာခံခြင်း။,Positive,2019-03-02 20:20:00, CulinaryExplorer , Twitter  , #CulinaryOdyssey #FlavorsAroundTheWorld ,35.0,70.0, Belgium         ,2019,3,2,20
Euphoria floods in as the final puzzle piece fits perfectly.       ,နောက်ဆုံး ပဟေဠိအပိုင်းအစ ကွက်တိဖြစ်သွားချိန်မှာ အလွန်အမင်း ပျော်ရွှင်မှုတွေ ပြည့်လျှံလာပါတယ်။,Positive,2022-06-08 15:30:00, PuzzleSolver    , Instagram , #Euphoria #PerfectPuzzle               ,20.0,40.0, Denmark         ,2022,6,8,15
Awe-struck by the grandeur of an ancient cathedral's intricate architecture. ,ရှေးဟောင်း ဘုရားရှိခိုးကျောင်းကြီးတစ်ခုရဲ့ ရှုပ်ထွေးတဲ့ ဗိသုကာလက်ရာရဲ့ ခမ်းနားထည်ဝါမှုကြောင့် အံ့သြတကြီး ငေးမောမိပါတယ်။,Positive,2018-08-18 14:45:00, CathedralVisitor , Facebook , #Awe #ArchitecturalGrandeur            ,18.0,35.0, Czech Republic  ,2018,8,18,14
Curiosity awakened by the mysteries of an ancient archaeological site. ,ရှေးဟောင်းသုတေသန နေရာတစ်ခုရဲ့ လျှို့ဝှက်ဆန်းကြယ်မှုတွေကြောင့် စူးစမ်းလိုစိတ် နိုးကြားလာပါတယ်။,Positive,2015-11-08 10:00:00, ArchaeologyEnthusiast , Instagram , #Curiosity #AncientMysteries          ,18.0,35.0, Australia ,2015,11,8,10
Giddy with excitement as the first snowflakes dance from the sky. ,ပထမဆုံး နှင်းပွင့်လေးတွေ ကောင်းကင်ကနေ ကခုန်ကျလာချိန်မှာ စိတ်လှုပ်ရှားမှုကြောင့် မူးဝေနောက်ကျိနေပါတယ်။,Positive,2020-12-02 17:30:00, SnowfallEnthusiast , Twitter  , #Excitement #SnowfallMagic             ,22.0,45.0, Canada         ,2020,12,2,17
Contentment envelops as the aroma of freshly baked bread fills the air. ,လတ်လတ်ဆတ်ဆတ် ဖုတ်ထားတဲ့ ပေါင်မုန့်ရဲ့ ရနံ့က လေထဲမှာ ပြည့်နှက်နေချိန်မှာ ကျေနပ်မှုက လွှမ်းခြုံလာပါတယ်။,Positive,2017-06-10 12:15:00, BreadLover     , Instagram , #Contentment #FreshBreadAroma          ,28.0,55.0, France          ,2017,6,10,12
