Text,Text-MM,Sentiment,Timestamp,User,Platform,Hashtags,Retweets,Likes,Country,Year,Month,Day,Hour
"I'm so tired of making decisions. I just want someone to tell me what to do for once.",ဆုံးဖြတ်ချက်တွေချရတာ အရမ်းပင်ပန်းနေပြီ။ တစ်ခါလောက်တော့ ကျွန်တော့်ကို ဘာလုပ်ရမလဲဆိုတာ တစ်ယောက်ယောက် ပြောပြစေချင်တယ်။,Negative,2024-03-21 16:45:00,DecisionFatigue,Facebook,#DecisionFatigue #Tired,4.0,16.0,Australia,2024,3,21,16
"I have a papercut and it stings so much more than it should.",စက္ကူဒဏ်ရာတစ်ခု ရထားတယ်၊ ဒါက ထင်ထားတာထက် အများကြီး ပိုနာတယ်။,Negative,2024-03-22 09:35:00,PapercutVictim,Twitter,#Papercut #SmallPain,1.0,4.0,India,2024,3,22,9
"I'm feeling really nostalgic and it's making me sad. I miss the past.",တကယ်ကို အတိတ်ကိုတမ်းတမိနေတယ်၊ ဒါက ကျွန်တော့်ကို ဝမ်းနည်းစေတယ်။ အတိတ်ကို လွမ်းတယ်။,Negative,2024-03-22 18:30:00,NostalgicSad,Instagram,#Nostalgia #MissingThePast,7.0,25.0,USA,2024,3,22,18
"I hate when my phone battery is at 1% and I'm nowhere near a charger.",ဖုန်းဘက်ထရီ ၁% ရှိတော့မယ်၊ ကျွန်တော် အားသွင်းကြိုးနဲ့ ဝေးရာမှာ ရှိနေတာကို မုန်းတယ်။,Negative,2024-03-23 15:15:00,BatteryPanic,Facebook,#BatteryLow #Panic,2.0,8.0,Canada,2024,3,23,15
"I'm so annoyed by people who talk during movies at the cinema. Just be quiet.",ရုပ်ရှင်ရုံမှာ ရုပ်ရှင်ကြည့်တုန်း စကားပြောတဲ့သူတွေကို အရမ်းစိတ်ညစ်တယ်။ တိတ်တိတ်လေးနေပါ။,Negative,2024-03-23 20:50:00,ShushTheater,Twitter,#MovieTheater #Shush,5.0,20.0,UK,2024,3,23,20
"I feel like I have no control over my life right now. Everything is just happening to me.",အခုချိန် ကျွန်တော့်ဘဝအပေါ် ထိန်းချုပ်မှု မရှိဘူးလို့ ခံစားရတယ်။ အရာအားလုံးက ကျွန်တော့်အပေါ် ဖြစ်ပျက်နေတာပဲ။,Negative,2024-03-24 11:40:00,NoControl,Instagram,#OutOfControl #Helpless,8.0,30.0,Australia,2024,3,24,11
"I'm trying to learn a new skill and I'm just not getting it. It's so discouraging.",ကျွမ်းကျင်မှုအသစ်တစ်ခု သင်ယူဖို့ ကြိုးစားနေတယ်၊ နားမလည်နိုင်ဘူး။ အရမ်းစိတ်ပျက်စရာကောင်းတယ်။,Negative,2024-03-24 14:25:00,LearningStruggle,Facebook,#NewSkill #Frustration,4.0,15.0,India,2024,3,24,14
"The smell of garbage is coming from somewhere and I can't find the source. It's driving me crazy.",အမှိုက်နံ့တစ်ခု တစ်နေရာရာက လာနေတယ်၊ အရင်းအမြစ်ကို ရှာမတွေ့ဘူး။ ဒါက ကျွန်တော့်ကို ရူးသွပ်စေတယ်။,Negative,2024-03-25 17:10:00,SmellHunter,Twitter,#BadSmell #Annoying,1.0,6.0,USA,2024,3,25,17
"I feel like I'm always cleaning up after other people. It's exhausting.",ကျွန်တော်က တခြားလူတွေရဲ့နောက်က အမြဲတမ်း သန့်ရှင်းရေးလုပ်နေရသလိုပဲ။ အရမ်းပင်ပန်းတယ်။,Negative,2024-03-25 21:55:00,AlwaysCleaning,Facebook,#CleaningUpAfterOthers #Tired,6.0,22.0,Canada,2024,3,25,21
"I'm so tired of toxic positivity. Sometimes it's okay to not be okay.",အဆိပ်သင့်တဲ့ အကောင်းမြင်စိတ်ကို အရမ်းငြီးငွေ့နေပြီ။ တစ်ခါတလေ ကောင်းကောင်းမနေဖို့က အဆင်ပြေပါတယ်။,Negative,2024-03-26 10:05:00,ToxicPositivityHater,Twitter,#ToxicPositivity #RealEmotions,5.0,27.0,UK,2024,3,26,10
"I ordered a new book online and it arrived with a bent cover. So disappointing.",အွန်လိုင်းက စာအုပ်အသစ်တစ်အုပ် မှာတယ်၊ အဖုံးကွေးနေတဲ့အနေအထားနဲ့ ရောက်လာတယ်။ အရမ်းစိတ်ပျက်စရာကောင်းတယ်။,Negative,2024-03-26 13:40:00,BookDamage,Instagram,#DamagedBook #Disappointed,2.0,9.0,Australia,2024,3,26,13
"I feel like I'm being ghosted by someone I was talking to. The silence is the worst.",ကျွန်တော်စကားပြောနေတဲ့သူတစ်ယောက် ကျွန်တော့်ကို ဖြတ်တောက်ပစ်သလို ခံစားရတယ်။ တိတ်ဆိတ်မှုက အဆိုးဆုံးပဲ။,Negative,2024-03-27 18:20:00,GhostedFeelings,Facebook,#Ghosting #SilenceHurts,7.0,24.0,India,2024,3,27,18
"I hate the feeling of wet hair on my neck after a shower. I need to dry it immediately.",ရေချိုးပြီးနောက် လည်ပင်းပေါ်က စိုစွတ်နေတဲ့ ဆံပင်တွေရဲ့ ခံစားချက်ကို မုန်းတယ်။ ချက်ချင်း အခြောက်ခံဖို့ လိုတယ်။,Negative,2024-03-27 20:45:00,WetHairHater,Twitter,#WetHair #SensoryIssue,1.0,5.0,USA,2024,3,27,20
"I have to attend a family gathering this weekend and I'm already dreading it.",ဒီစနေ၊ တနင်္ဂနွေ မိသားစုစုဝေးပွဲတစ်ခုကို တက်ရောက်ရမယ်၊ အခုကတည်းက ကြောက်ရွံ့နေပြီ။,Negative,2024-03-28 09:30:00,FamilyDread,Instagram,#FamilyGathering #Dread,4.0,18.0,Canada,2024,3,28,9
"I feel like I'm not progressing in my career. I'm stuck in the same place.",ကျွန်တော့်အသက်မွေးဝမ်းကျောင်းမှာ တိုးတက်မှုမရှိဘူးလို့ ခံစားရတယ်။ နေရာတစ်ခုတည်းမှာ ညပ်နေတယ်။,Negative,2024-03-28 15:15:00,StuckInCareer,Facebook,#CareerStagnation #Frustrated,9.0,33.0,UK,2024,3,28,15
"I'm so annoyed when people walk slowly in the middle of the aisle at the supermarket.",စူပါမားကက်မှာ လူတွေက စင်္ကြံအလယ်မှာ ဖြည်းဖြည်းချင်း လမ်းလျှောက်တဲ့အခါ အရမ်းစိတ်ညစ်တယ်။,Negative,2024-03-29 12:50:00,SpeedShopper,Twitter,#SupermarketSlowWalkers #Annoying,3.0,12.0,Australia,2024,3,29,12
"I'm trying to cut back on sugar and I'm having major cravings. This is hard.",သကြားလျှော့စားဖို့ ကြိုးစားနေတယ်၊ အရမ်းတောင့်တနေတယ်။ ဒါက ခက်တယ်။,Negative,2024-03-29 19:05:00,SugarCraving,Instagram,#SugarDetox #Cravings,2.0,10.0,India,2024,3,29,19
"I feel like I'm always the one who reaches out to friends first. It's tiring being the initiator.",ကျွန်တော်က သူငယ်ချင်းတွေကို အရင်ဆုံး ဆက်သွယ်ရတဲ့သူပဲ။ ပဏာမလုပ်ရတာ ပင်ပန်းတယ်။,Negative,2024-03-30 14:30:00,InitiatorTired,Facebook,#Friendship #OneSided,6.0,21.0,USA,2024,3,30,14
"I hate it when my earbuds get tangled. It takes forever to untangle them.",ကျွန်တော့်နားကြပ်ကြိုးတွေ ရှုပ်သွားတာကို မုန်းတယ်။ ဖြေဖို့ အချိန်အတော်ကြာတယ်။,Negative,2024-03-30 10:20:00,TangledWires,Twitter,#TangledEarbuds #PetPeeve,1.0,4.0,Canada,2024,3,30,10
"I just stepped on a piece of Lego. The pain is unreal.",Lego တုံးတစ်တုံးပေါ် နင်းမိလိုက်တယ်။ နာကျင်မှုက မယုံနိုင်စရာပဲ။,Negative,2024-03-31 17:45:00,LegoVictim,Instagram,#LegoPain #ParentLife,5.0,26.0,UK,2024,3,31,17
"I feel like I'm invisible at work. My contributions are never acknowledged.",အလုပ်မှာ ကျွန်တော် မမြင်ရဘူးလို့ ခံစားရတယ်။ ကျွန်တော့်ရဲ့ ပံ့ပိုးမှုတွေကို ဘယ်တော့မှ အသိအမှတ်မပြုဘူး။,Negative,2024-03-31 13:15:00,InvisibleWorker,Facebook,#WorkInvisibility #Underappreciated,8.0,29.0,Australia,2024,3,31,13
"I'm so tired of the 'hustle culture'. Can we just normalize resting?",'အလုပ်ကြိုးစားမှုယဉ်ကျေးမှု' ကို အရမ်းငြီးငွေ့နေပြီ။ အနားယူတာကို ပုံမှန်ဖြစ်အောင် လုပ်လို့မရဘူးလား။,Negative,2024-04-01 09:40:00,RestAdvocate,Twitter,#HustleCulture #Burnout,7.0,28.0,India,2024,4,1,9
"I feel like I'm always running out of time. There are never enough hours in the day.",ကျွန်တော် အချိန်က အမြဲတမ်း ကုန်နေသလိုပဲ။ တစ်နေ့တာမှာ နာရီတွေ အမြဲမလုံလောက်ဘူး။,Negative,2024-04-01 20:10:00,TimePoor,Instagram,#NotEnoughTime #Rushed,4.0,17.0,USA,2024,4,1,20
"I'm so annoyed when people don't reply to messages but are active on social media.",လူတွေက မက်ဆေ့ချ်တွေကို ပြန်မဖြေဘဲ ဆိုရှယ်မီဒီယာပေါ်မှာ အက်တစ်ဖြစ်နေတဲ့အခါ အရမ်းစိတ်ညစ်တယ်။,Negative,2024-04-02 15:30:00,LeftOnRead,Facebook,#LeftOnRead #Annoying,3.0,11.0,Canada,2024,4,2,15
"I tried a new restaurant and the food was bland and overpriced. Won't be going back.",စားသောက်ဆိုင်အသစ်တစ်ခုကို စမ်းကြည့်တယ်၊ အစားအစာက အရသာမရှိဘဲ ဈေးလည်းကြီးတယ်။ နောက်တစ်ခါ ပြန်မသွားတော့ဘူး။,Negative,2024-04-02 19:55:00,FoodCritic2,Twitter,#RestaurantReview #Disappointed,5.0,19.0,UK,2024,4,2,19
"I'm so tired of pretending to be okay when I'm not.",ကျွန်တော် ကောင်းကောင်းမနေတဲ့အခါ ကောင်းနေတယ်လို့ ဟန်ဆောင်ရတာ အရမ်းပင်ပန်းတယ်။,Negative,2024-04-03 11:45:00,FakingIt,Instagram,#MentalHealth #NotOkay,9.0,34.0,Australia,2024,4,3,11
"I hate it when you're in a hurry and every traffic light is red.",အလျင်လိုနေချိန် မီးပွိုင့်တိုင်း အနီရောင်ဖြစ်နေတာကို မုန်းတယ်။,Negative,2024-04-03 08:20:00,RedLightRunner,Facebook,#TrafficLights #BadLuck,2.0,9.0,India,2024,4,3,8
"I feel like I have nothing to look forward to. My life is just... blah.",ကျွန်တော် မျှော်လင့်စရာ ဘာမှမရှိဘူးလို့ ခံစားရတယ်။ ကျွန်တော့်ဘဝက... ဗလာကျင်းနေတယ်။,Negative,2024-04-04 16:35:00,BlandLife,Twitter,#NoExcitement #Blah,6.0,22.0,USA,2024,4,4,16
"I'm so annoyed that my favorite show got canceled. It ended on a cliffhanger!",ကျွန်တော်အကြိုက်ဆုံးရှိုး ဖျက်သိမ်းခံရတာ အရမ်းစိတ်ညစ်တယ်။ စိတ်လှုပ်ရှားစရာအဆုံးသတ်နဲ့ ပြီးသွားတယ်။,Negative,2024-04-04 20:20:00,ShowCanceled,Instagram,#ShowCanceled #Disappointed,3.0,14.0,Canada,2024,4,4,20
"I hate when I'm trying to sleep and I can't stop thinking about embarrassing moments.",အိပ်ဖို့ကြိုးစားနေတုန်း ရှက်စရာကောင်းတဲ့အခိုက်အတန့်တွေကို မရပ်မနား တွေးမိတာကို မုန်းတယ်။,Negative,2024-04-05 23:10:00,InsomniacShame,Facebook,#BedtimeThoughts #Cringe,4.0,16.0,UK,2024,4,5,23
"I feel like I'm always waiting for something that never comes.",ကျွန်တော်က ဘယ်တော့မှ မလာတဲ့ အရာတစ်ခုကို အမြဲတမ်း စောင့်နေရသလိုပဲ။,Negative,2024-04-05 13:55:00,ForeverWaiting,Twitter,#Waiting #Anticipation,5.0,20.0,Australia,2024,4,5,13
"I'm so tired of people who are always late. It's so disrespectful of my time.",အမြဲတမ်းနောက်ကျတဲ့သူတွေကို အရမ်းငြီးငွေ့နေပြီ။ ဒါက ကျွန်တော့်အချိန်ကို အရမ်းမရိုမသေဖြစ်တယ်။,Negative,2024-04-06 10:30:00,PunctualityMatters,Facebook,#AlwaysLate #Disrespectful,7.0,25.0,India,2024,4,6,10
"I just got a flat tire on my way to an important meeting. Just my luck.",အရေးကြီးတဲ့အစည်းအဝေးကို သွားတဲ့လမ်းမှာ တာယာပြားသွားတယ်။ ကျွန်တော့်ကံပဲ။,Negative,2024-04-06 08:45:00,FlatTireWoes,Instagram,#FlatTire #BadTiming,2.0,12.0,USA,2024,4,6,8
"I'm so annoyed with the constant notifications from group chats. Mute isn't enough.",အဖွဲ့လိုက်စကားပြောခန်းတွေဆီက အဆက်မပြတ် အသိပေးချက်တွေကို အရမ်းစိတ်ညစ်တယ်။ အသံပိတ်တာတောင် မလုံလောက်ဘူး။,Negative,2024-04-07 14:15:00,GroupChatAnnoyed,Twitter,#GroupChat #Notifications,3.0,10.0,Canada,2024,4,7,14
"I feel like I'm just going through the motions at my job. There's no passion left.",ကျွန်တော် အလုပ်မှာ လုပ်ရိုးလုပ်စဉ်အတိုင်း ဖြတ်သန်းနေရသလိုပဲ။ စိတ်အားထက်သန်မှု မရှိတော့ဘူး။,Negative,2024-04-07 17:50:00,PassionlessWorker,Facebook,#JobBurnout #NoPassion,6.0,23.0,UK,2024,4,7,17
"I hate the feeling of a dry throat. Nothing seems to fix it.",လည်ချောင်းခြောက်တဲ့ ခံစားချက်ကို မုန်းတယ်။ ဘာမှ ပြေလည်အောင် မလုပ်နိုင်ဘူး။,Negative,2024-04-08 09:25:00,DryThroatSufferer,Instagram,#DryThroat #Uncomfortable,1.0,5.0,Australia,2024,4,8,9
"I'm so tired of people who only talk about themselves. It's so draining.",ကိုယ့်အကြောင်းပဲ ပြောတတ်တဲ့သူတွေကို အရမ်းငြီးငွေ့နေပြီ။ အရမ်းစွမ်းအင်ကုန်တယ်။,Negative,2024-04-08 20:05:00,OneSidedTalk,Twitter,#SelfCentered #Tired,4.0,17.0,India,2024,4,8,20
"I feel like I'm not where I thought I would be at this point in my life. It's disappointing.",ကျွန်တော့်ဘဝရဲ့ ဒီအချိန်မှာ ကျွန်တော်ထင်ထားတဲ့ နေရာမှာ မရှိဘူးလို့ ခံစားရတယ်။ စိတ်ပျက်စရာကောင်းတယ်။,Negative,2024-04-09 15:35:00,OffTrack,Facebook,#LifeExpectations #Disappointed,8.0,31.0,USA,2024,4,9,15
"I'm so annoyed when I'm trying to concentrate and someone keeps interrupting me.",အာရုံစူးစိုက်ဖို့ ကြိုးစားနေတုန်း တစ်ယောက်ယောက်က ဆက်တိုက် နှောင့်ယှက်နေတဲ့အခါ အရမ်းစိတ်ညစ်တယ်။,Negative,2024-04-09 11:20:00,FocusInterrupted,Instagram,#Interruptions #Annoying,3.0,13.0,Canada,2024,4,9,11
"I hate it when you're looking forward to a quiet evening and then something unexpected comes up.",တိတ်ဆိတ်တဲ့ ညနေခင်းကို မျှော်လင့်နေတုန်း မမျှော်လင့်တဲ့အရာတစ်ခု ပေါ်လာတာကို မုန်းတယ်။,Negative,2024-04-10 18:45:00,QuietEveningRuined,Twitter,#PlansRuined #Annoyed,2.0,8.0,UK,2024,4,10,18
"I feel like I'm constantly comparing myself to others and it's making me miserable.",ကိုယ့်ကိုယ်ကို အခြားသူတွေနဲ့ အမြဲတမ်း နှိုင်းယှဉ်နေရသလိုပဲ၊ ဒါက ကျွန်တော့်ကို စိတ်ညစ်စေတယ်။,Negative,2024-04-10 21:30:00,ComparisonTrap,Facebook,#Comparison #Misery,7.0,27.0,Australia,2024,4,10,21
"I'm so tired of the rain. I need some sunshine in my life.",မိုးရွာတာကို အရမ်းငြီးငွေ့နေပြီ။ ကျွန်တော့်ဘဝမှာ နေရောင်ခြည်လေး လိုအပ်တယ်။,Negative,2024-04-11 07:55:00,RainTired,Instagram,#RainyDay #OverIt,2.0,9.0,India,2024,4,11,7
"I just realized I have a dentist appointment in 10 minutes and I'm 20 minutes away. I'm going to be late.",သွားဆရာဝန်နဲ့ မိနစ် ၁၀ အတွင်း ချိန်းထားတာ အခုမှသိလိုက်တယ်၊ ကျွန်တော် မိနစ် ၂၀ ဝေးတယ်။ ကျွန်တော် နောက်ကျတော့မယ်။,Negative,2024-04-11 09:10:00,RunningLateAgain,Twitter,#Late #Oops,5.0,18.0,USA,2024,4,11,9
"I hate when you're in a bad mood and someone tells you to 'just smile'. It's so invalidating.",စိတ်မကောင်းဖြစ်နေချိန် တစ်ယောက်ယောက်က 'ပြုံးလိုက်ပါ' လို့ပြောတာကို မုန်းတယ်။ အရမ်းတန်ဖိုးမထားသလိုခံစားရတယ်။,Negative,2024-04-12 16:20:00,JustSmileHater,Facebook,#ToxicPositivity #Invalidating,4.0,15.0,Canada,2024,4,12,16
"I'm so annoyed with my slow internet. I can't stream anything without buffering.",ကျွန်တော့်အင်တာနက်နှေးတာကို အရမ်းစိတ်ညစ်တယ်။ ကြားဖြတ်ရပ်ခြင်းမရှိဘဲ ဘာမှ stream လုပ်လို့မရဘူး။,Negative,2024-04-12 20:50:00,BufferingHell,Instagram,#SlowInternet #Annoying,3.0,11.0,UK,2024,4,12,20
"I feel like I'm carrying the weight of the world on my shoulders. So stressed.",ကမ္ဘာလောကရဲ့ဝန်ကို ကျွန်တော့်ပခုံးပေါ်မှာ ထမ်းထားရသလို ခံစားရတယ်။ အရမ်းစိတ်ဖိစီးတယ်။,Negative,2024-04-13 14:10:00,WeightOnShoulders,Twitter,#Overwhelmed #Stress,9.0,35.0,Australia,2024,4,13,14
"I'm so tired of hearing about everyone's highlight reels on social media. It's not real life.",ဆိုရှယ်မီဒီယာပေါ်က လူတိုင်းရဲ့ မီးမောင်းထိုးပြမှုတွေအကြောင်း ကြားရတာ အရမ်းငြီးငွေ့နေပြီ။ ဒါက တကယ့်ဘဝမဟုတ်ဘူး။,Negative,2024-04-13 10:45:00,SocialMediaFatigue,Facebook,#SocialMedia #FakeReality,6.0,24.0,India,2024,4,13,10
"I hate it when my alarm goes off and I just want five more minutes.",နှိုးစက်မြည်တဲ့အခါ နောက်ထပ် ငါးမိနစ်လောက် ထပ်အိပ်ချင်တာကို မုန်းတယ်။,Negative,2024-04-14 06:45:00,SnoozeButtonLover,Instagram,#SnoozeButton #MorningStruggles,1.0,6.0,USA,2024,4,14,6
"I feel like I have no one to talk to about how I'm really feeling.",ကျွန်တော် တကယ်ခံစားနေရတဲ့အကြောင်း ပြောပြဖို့ လူမရှိဘူးလို့ ခံစားရတယ်။,Negative,2024-04-14 22:20:00,NoListener,Twitter,#Loneliness #NeedToTalk,5.0,20.0,Canada,2024,4,14,22
"I'm so annoyed when people block the aisle on the airplane while they figure out their luggage.",လေယာဉ်ပေါ်မှာ လူတွေက သူတို့ခရီးဆောင်အိတ်တွေကို ရှာနေတုန်း စင်္ကြံကို ပိတ်ဆို့တဲ့အခါ အရမ်းစိတ်ညစ်တယ်။,Negative,2024-04-15 12:30:00,AirplaneAisleBlocker,Facebook,#AirplaneEtiquette #Annoying,3.0,13.0,UK,2024,4,15,12
"I'm so tired of the cold weather. I'm ready for spring.",အေးတဲ့ရာသီဥတုကို အရမ်းငြီးငွေ့နေပြီ။ နွေဦးအတွက် အဆင်သင့်ဖြစ်နေပြီ။,Negative,2024-04-15 15:45:00,WinterIsOver,Instagram,#ReadyForSpring #ColdWeather,2.0,8.0,Australia,2024,4,15,15
"I feel like I'm always the one making compromises in my relationships.",ကျွန်တော့်ဆက်ဆံရေးတွေမှာ ကျွန်တော်က အမြဲတမ်း အလျှော့အတင်းလုပ်ရတဲ့သူပဲ။,Negative,2024-04-16 17:10:00,CompromiseKing,Twitter,#Relationships #Compromise,7.0,26.0,India,2024,4,16,17
"I hate it when you're in a good dream and you wake up suddenly.",အိပ်မက်ကောင်းနေတုန်း ရုတ်တရက် နိုးလာတာကို မုန်းတယ်။,Negative,2024-04-16 08:35:00,DreamInterrupted,Facebook,#BadTiming #WakingUp,1.0,5.0,USA,2024,4,16,8
"I'm so annoyed by the sound of someone tapping their pen repeatedly. It's driving me crazy.",တစ်ယောက်ယောက်က ဘောပင်ကို ထပ်ခါထပ်ခါ ခေါက်နေတဲ့အသံကို အရမ်းစိတ်ညစ်တယ်။ ဒါက ကျွန်တော့်ကို ရူးသွပ်စေတယ်။,Negative,2024-04-17 11:25:00,PenTappingHater,Instagram,#AnnoyingSounds #Sensory,2.0,7.0,Canada,2024,4,17,11
"I feel like I'm in a fog. I can't think clearly.",ကျွန်တော် မြူထဲမှာ ရောက်နေသလိုပဲ။ ရှင်းရှင်းလင်းလင်း မတွေးနိုင်ဘူး။,Negative,2024-04-17 19:50:00,FoggyBrain,Twitter,#BrainFog #Tired,4.0,15.0,UK,2024,4,17,19
"I'm so tired of people who don't use their indicators when driving. It's not safe.",ကားမောင်းတဲ့အခါ လူတွေက အချက်ပြမီးမသုံးတဲ့သူတွေကို အရမ်းငြီးငွေ့နေပြီ။ ဒါက မလုံခြုံဘူး။,Negative,2024-04-18 14:20:00,SafeDriverAdvocate,Facebook,#Indicators #Safety,3.0,12.0,Australia,2024,4,18,14
"I just burned my tongue on hot coffee. Now everything I eat for the rest of the day will taste weird.",ကော်ဖီပူပူနဲ့ လျှာလောင်သွားတယ်။ အခု ဒီနေ့ကျန်တဲ့အချိန် ကျွန်တော်စားသမျှ အရသာက ထူးဆန်းနေလိမ့်မယ်။,Negative,2024-04-18 09:05:00,BurntTongue,Instagram,#BurnedTongue #FirstWorldProblems,1.0,4.0,India,2024,4,18,9
"I hate the feeling of being stared at. It makes my skin crawl.",စိုက်ကြည့်ခံရတဲ့ ခံစားချက်ကို မုန်းတယ်။ ဒါက ကျွန်တော့်အရေပြားကို တွန့်စေတယ်။,Negative,2024-04-19 16:40:00,StaredAt,Twitter,#Uncomfortable #Anxiety,3.0,14.0,USA,2024,4,19,16
"I'm so annoyed when I'm in the middle of a task and someone asks me to do something else.",အလုပ်တစ်ခုလုပ်နေတုန်း တစ်ယောက်ယောက်က နောက်တစ်ခုလုပ်ခိုင်းတဲ့အခါ အရမ်းစိတ်ညစ်တယ်။,Negative,2024-04-19 13:15:00,InterruptedAgain,Facebook,#Multitasking #Annoyed,4.0,15.0,Canada,2024,4,19,13
